{"schema":"deepbom.evidence_compatibility_catalog.v1","catalog_version":"0.18.0","status":"draft","baseline":"Canonical Provenance IR; current Evidence IR members only. Retired identifiers are not aliases.","scope":"Core input-to-IR crosswalk and principal evidence exports. Field groups are navigation aids, not an exhaustive native-format field inventory or a claim of round-trip equivalence. Auxiliary CLI commands and runtime-specific profile fields are outside this catalog.","validation_boundary":"Implementation and regression-check references are traceability links, not test execution receipts or external certification. Artifact-specific coverage is reported in the resulting IR.","version_policy":"Catalog, member schema, calculation method and engine versions are independent. Preserve snapshots; update the catalog version whenever its pinned definitions change.","nodes":[{"id":"artifact","kind":"ir","name":"Artifact IR","contract":"deepbom.artifact_ir.v2","boundary":"Availability of individual fields depends on the serialized artifact.","json_schema":"https://deepbom.org/schemas/deepbom-artifact-ir-v2.schema.json","digest_field":"artifact_ir_sha256"},{"id":"model","kind":"ir","name":"Model IR","contract":"deepbom.model_ir.v1","boundary":"Availability of individual fields depends on the serialized artifact.","json_schema":"https://deepbom.org/schemas/deepbom-model-ir-v1.schema.json","digest_field":"model_ir_sha256"},{"id":"weight","kind":"ir","name":"Weight IR","contract":"deepbom.weight_ir.v1","boundary":"Optional; source-bound evidence only.","json_schema":"https://deepbom.org/schemas/deepbom-numerical-ir-v1.schema.json#/$defs/weight_ir","digest_field":"weight_ir_sha256"},{"id":"activation","kind":"ir","name":"Activation IR","contract":"deepbom.activation_ir.v1","boundary":"Optional; source-bound evidence only.","json_schema":"https://deepbom.org/schemas/deepbom-numerical-ir-v1.schema.json#/$defs/activation_ir","digest_field":"activation_ir_sha256"},{"id":"provenance","kind":"ir","name":"Provenance IR","contract":"deepbom.provenance_ir.v1","boundary":"Optional; source-bound evidence only.","json_schema":"https://deepbom.org/schemas/deepbom-provenance-ir-v1.schema.json","digest_field":"provenance_ir_sha256"},{"id":"input-tflite","kind":"input","name":"TFLite","contract":"Model / SubGraph / Tensor / Buffer","boundary":"Full FlatBuffer artifact analysis; placement remains a source/build projection until runtime evidence is imported.","json_schema":null,"maturity":{"format":"tflite","overall":"stable","parser":"stable","serialized_graph":"stable","quantization":"stable","execution_placement":"source_bounded","interpretation_boundary":"Full FlatBuffer artifact analysis; placement remains a source/build projection until runtime evidence is imported."}},{"id":"input-onnx","kind":"input","name":"ONNX","contract":"ModelProto.graph / NodeProto / ValueInfoProto / TensorProto","boundary":"Full protobuf and external-data analysis; execution-provider assignment is never inferred from eligibility.","json_schema":null,"maturity":{"format":"onnx","overall":"stable","parser":"stable","serialized_graph":"stable","quantization":"stable","execution_placement":"source_bounded","interpretation_boundary":"Full protobuf and external-data analysis; execution-provider assignment is never inferred from eligibility."}},{"id":"input-gguf","kind":"input","name":"GGUF","contract":"Header / metadata key-values / tensor directory / GGML blocks","boundary":"GGUF serializes tensor storage and architecture metadata, not an executable operator DAG.","json_schema":null,"maturity":{"format":"gguf","overall":"stable","parser":"stable","serialized_graph":"not_applicable","quantization":"stable_storage_encoding","execution_placement":"not_applicable","interpretation_boundary":"GGUF serializes tensor storage and architecture metadata, not an executable operator DAG."}},{"id":"input-safetensors","kind":"input","name":"SafeTensors","contract":"JSON header / dtype / shape / data_offsets / shard index","boundary":"SafeTensors serializes named tensor storage; graph and placement require a separately bound executable artifact.","json_schema":null,"maturity":{"format":"safetensors","overall":"stable","parser":"stable","serialized_graph":"not_applicable","quantization":"stable_metadata_bound","execution_placement":"not_applicable","interpretation_boundary":"SafeTensors serializes named tensor storage; graph and placement require a separately bound executable artifact."}},{"id":"input-coreml","kind":"input","name":"Core ML","contract":"Model description / NeuralNetwork / ML Program / package manifest","boundary":"NeuralNetwork and ML Program evidence is supported; compressed and flexible contracts remain fixture-bounded.","json_schema":null,"maturity":{"format":"coreml","overall":"preview","parser":"preview","serialized_graph":"preview","quantization":"preview","execution_placement":"imported_evidence_only","interpretation_boundary":"NeuralNetwork and ML Program evidence is supported; compressed and flexible contracts remain fixture-bounded."}},{"id":"input-executorch","kind":"input","name":"ExecuTorch","contract":"ET12 plans / EValues / instructions / segments / FT01","boundary":"ET12/FT01 parsing is bounded; backend and operator completeness require selected-build evidence.","json_schema":null,"maturity":{"format":"executorch","overall":"preview","parser":"preview","serialized_graph":"preview","quantization":"limited","execution_placement":"selected_build_required","interpretation_boundary":"ET12/FT01 parsing is bounded; backend and operator completeness require selected-build evidence."}},{"id":"input-graphdef","kind":"input","name":"TensorFlow GraphDef","contract":"GraphDef.node / inputs / Placeholder / Const","boundary":"GraphDef node, referenced data/control dependencies, and bounded Placeholder/Const tensor contracts are decoded without execution; explicit model I/O, arbitrary op output contracts, kernels, and runtime schedule are not claimed.","json_schema":null,"maturity":{"format":"graphdef","overall":"preview","parser":"preview","serialized_graph":"preview","quantization":"tensor_content_only","execution_placement":"not_assessed","interpretation_boundary":"GraphDef node, referenced data/control dependencies, and bounded Placeholder/Const tensor contracts are decoded without execution; explicit model I/O, arbitrary op output contracts, kernels, and runtime schedule are not claimed."}},{"id":"input-savedmodel","kind":"input","name":"TensorFlow SavedModel","contract":"First MetaGraph / SignatureDef / package member identities","boundary":"The first serialized MetaGraph and SignatureDef tensor contracts are decoded. A selected directory is completely path/size/SHA-256 bound, while variable, asset, extra-MetaGraph, kernel, and runtime semantics remain explicitly incomplete.","json_schema":null,"maturity":{"format":"savedmodel","overall":"preview","parser":"preview","serialized_graph":"preview","quantization":"package_identity_only","execution_placement":"not_assessed","interpretation_boundary":"The first serialized MetaGraph and SignatureDef tensor contracts are decoded. A selected directory is completely path/size/SHA-256 bound, while variable, asset, extra-MetaGraph, kernel, and runtime semantics remain explicitly incomplete."}},{"id":"input-hdf5","kind":"input","name":"HDF5","contract":"Superblock / safe container header","boundary":"Safe-envelope preview parses the HDF5 superblock only; no Keras objects, groups, datasets, links, tensor values, or graph are claimed.","json_schema":null,"maturity":{"format":"hdf5","overall":"preview","parser":"preview","serialized_graph":"not_applicable","quantization":"not_assessed","execution_placement":"not_applicable","interpretation_boundary":"Safe-envelope preview parses the HDF5 superblock only; no Keras objects, groups, datasets, links, tensor values, or graph are claimed."}},{"id":"input-keras","kind":"input","name":"Keras archive","contract":"config.json / Sequential order / keras_history","boundary":"Bounded Sequential or explicit keras_history layer dependencies are projected from config.json without constructing Keras objects, lowering layers, or asserting runtime order.","json_schema":null,"maturity":{"format":"keras","overall":"preview","parser":"preview","serialized_graph":"declarative_config_graph","quantization":"archive_identity_only","execution_placement":"not_applicable","interpretation_boundary":"Bounded Sequential or explicit keras_history layer dependencies are projected from config.json without constructing Keras objects, lowering layers, or asserting runtime order."}},{"id":"input-pt2","kind":"input","name":"PyTorch PT2","contract":"First models/*.json ExportedProgram dependencies","boundary":"The first bounded PT2 models/*.json dependency graph is projected without torch.export.load, pickle loading, native code, kernel, or runtime claims.","json_schema":null,"maturity":{"format":"pt2","overall":"preview","parser":"preview","serialized_graph":"declarative_json_graph","quantization":"archive_identity_only","execution_placement":"not_applicable","interpretation_boundary":"The first bounded PT2 models/*.json dependency graph is projected without torch.export.load, pickle loading, native code, kernel, or runtime claims."}},{"id":"input-pytorch_checkpoint","kind":"input","name":"PyTorch checkpoint","contract":"Archive members / pickle opcode inventory","boundary":"Safe-envelope preview inventories archive and pickle opcodes/globals without torch.load, object construction, imports, or executable-graph claims.","json_schema":null,"maturity":{"format":"pytorch_checkpoint","overall":"preview","parser":"preview","serialized_graph":"not_applicable","quantization":"not_assessed","execution_placement":"not_applicable","interpretation_boundary":"Safe-envelope preview inventories archive and pickle opcodes/globals without torch.load, object construction, imports, or executable-graph claims."}},{"id":"input